{
  "$schema": "./schema.json",
  "research_id": "RSC-0007",
  "question": "How do hyperscale engineering systems and agent platforms (Google SRE, Microsoft Azure Orchestration, AWS Step Functions, Netflix Conductor, Palantir Foundry, OpenAI Agent Frameworks, Anthropic MCP) orchestrate end-to-end mission lifecycles, Agent Councils, context handoffs, and Meta-Governance verifiers?",
  "scope": "Mission-level engineering lifecycles, multi-agent council handoffs, synthetic project isolation, meta-governance verifier independence, and evidence-first release review",
  "sources": ["SRC-0001", "SRC-0002", "SRC-0003", "SRC-0005", "SRC-0006", "SRC-0009", "SRC-0010"],
  "claims": [
    "Mission-level lifecycle orchestration enforces strict 19-state progress gates from discovery to release review, preventing premature execution.",
    "Meta-Governance verifiers must operate independently from execution actors to eliminate verifier self-certification risks."
  ],
  "evidence": [
    "AWS Step Functions and Netflix Conductor use independent supervisor subroutines to evaluate execution outcomes.",
    "Palantir Foundry enforces data provenance and audit trails for end-to-end analytical pipelines."
  ],
  "observations": [
    "Context handoffs between Agent Council roles must include explicit facts, assumptions, evidence references, and unresolved questions.",
    "Synthetic project fixtures (website, api, ecommerce, data) isolate mission simulation from real target projects."
  ],
  "patterns": [
    "PAT-0001: Spec-Driven Development",
    "PAT-0002: Evidence-First Verification",
    "PAT-0003: Local-First Control Plane"
  ],
  "contradictions": [],
  "limitations": [
    "Synthetic mission simulations use synthetic mock adapters until commercial API execution is authorized."
  ],
  "confidence": "HIGH",
  "maturity": "MATURE",
  "adoption_level": "ADOPT",
  "strategic_value": "CRITICAL",
  "eos_relevance": "CRITICAL",
  "recommendation": "Implement Autonomous Engineering Mission Engine, 19-state lifecycle, Agent Council, Meta-Governance Engine, and synthetic mission fixtures in EOS Control Plane.",
  "verification_status": "VERIFIED"
}
