{
  "$schema": "./schema.json",
  "research_id": "RSC-0001",
  "question": "What core mechanisms does Gentleman Programming / Engram use for persistent memory, session continuity, and agent governance, and how should EOS adopt or adapt them?",
  "scope": "Engram MCP server, session summary hooks, observation tracking, context retrieval, and decision logging",
  "sources": ["SRC-0004", "SRC-0002"],
  "claims": [
    "Engram prevents LLM context loss across session resets by storing structured observations in local sqlite/JSON memory.",
    "Proactive triggers (bug fixes, decisions, gotchas) ensure observations are recorded immediately without human intervention.",
    "Session summary protocols allow new agent sessions to resume with complete knowledge of past accomplishments and next steps."
  ],
  "evidence": [
    "Engram MCP protocol logs demonstrate successful retrieval of past observations across session compactions.",
    "EOS EVD-0001 through EVD-0009 demonstrate deterministic evidence logging adhering to structured memory principles."
  ],
  "observations": [
    "Gentleman/Engram decouples internal memory saving from user-facing responses.",
    "Session close protocol enforces structured summary sections: Goal, Instructions, Discoveries, Accomplished, Next Steps, Relevant Files.",
    "Topic keys enable non-destructive upserts for evolving architecture decisions."
  ],
  "patterns": [
    "PAT-0001: Persistent Dual-Layer Memory (Transient Chat + Immutable Evidence Log)",
    "PAT-0002: Structured Session Closing Protocol",
    "PAT-0003: Non-Destructive Topic Upsert Key"
  ],
  "contradictions": [
    "Engram assumes memory saving is purely internal and non-blocking, whereas strict governance requiring explicit sign-off must block execution until human authorization is recorded."
  ],
  "limitations": [
    "Memory retrieval quality depends on search query precision.",
    "Stale observations require periodic lifecycle review (`needs_review` flag)."
  ],
  "confidence": "HIGH",
  "maturity": "EMERGING",
  "adoption_level": "ADOPT",
  "strategic_value": "CRITICAL",
  "eos_relevance": "CRITICAL",
  "recommendation": "Adopt Engram persistent memory protocol and session summary structure as standard EOS Control Plane governance components while preserving strict write barrier blocking gates.",
  "verification_status": "VERIFIED"
}
