{
  "$schema": "./schema.json",
  "research_id": "RSC-0009",
  "question": "How do hyperscale software engineering factories (Google SRE, Google DeepMind, Microsoft Engineering, AWS Orchestration, OpenAI Frameworks, Anthropic MCP, Netflix Conductor, Palantir Foundry, SEI CMU, OWASP) achieve end-to-end mission proving, strategy deliberation, capability-driven tool routing, and independent meta-verification without vendor lock-in?",
  "scope": "End-to-end 25-step mission lifecycle integration, composition layer architecture, multi-agent council handoffs, failure recovery proving, and verifier independence",
  "sources": ["SRC-0001", "SRC-0002", "SRC-0003", "SRC-0005", "SRC-0006", "SRC-0009", "SRC-0010"],
  "claims": [
    "End-to-end mission proving requires a composition layer that orchestrates existing specialized engines without duplicating state machines or policy logic.",
    "Verifier independence is essential to prevent self-certification loops where execution actors approve unverified outputs."
  ],
  "evidence": [
    "AWS Step Functions and Netflix Conductor use top-level state machine orchestrators to compose granular sub-workflows and microservices.",
    "SEI CMU software factory standards require traceable evidence chains for every artifact before release sign-off."
  ],
  "observations": [
    "Structured context handoffs between Agent Council roles require explicit facts, assumptions, artifacts, and verification criteria.",
    "Controlled failure injection during mission proving proves that retries, fallbacks, replans, and rollbacks operate within policy bounds."
  ],
  "patterns": [
    "PAT-0001: Spec-Driven Development",
    "PAT-0002: Evidence-First Verification",
    "PAT-0003: Local-First Control Plane"
  ],
  "contradictions": [],
  "limitations": [
    "Mission proving operates via synthetic mock adapters prior to live commercial API activation."
  ],
  "confidence": "HIGH",
  "maturity": "MATURE",
  "adoption_level": "ADOPT",
  "strategic_value": "CRITICAL",
  "eos_relevance": "CRITICAL",
  "recommendation": "Implement Autonomous Engineering Factory Integration Engine, End-to-End Mission Contracts, Proving Scorecard Engine, and Meta-Verification auditing in EOS Control Plane.",
  "verification_status": "VERIFIED"
}
